{
  "task_id": "osw2-041-split-expense-spreadsheet",
  "instruction": "把本月的转账记录整理成表格并保存到 /home/user/Desktop/账单.xlsx。",
  "step_idx": 12,
  "budget": { "steps_remaining": 38, "wall_seconds_remaining": 1024.5 },
  "screenshot": {
    "path": "screenshots/step_11.png",
    "sha256": "0123456789abcdef0123456789abcdef0123456789abcdef0123456789abcdef",
    "width": 1920,
    "height": 1080,
    "captured": false
  },
  "accessibility_tree": {
    "present": true,
    "source": "jev",
    "digest": "fedcba9876543210fedcba9876543210fedcba9876543210fedcba9876543210",
    "node_count": 154,
    "path": "a11y/step_11.json"
  },
  "last_receipt": {
    "returncode": 0,
    "stdout": "backup.txt  notes.txt  销售数据.xlsx",
    "stderr": "",
    "kind": "cli",
    "acknowledged": true,
    "full_output_ref": "artifacts/step_11_cli_full.txt"
  },
  "protocol_version": "0.1"
}
